{
  "id": "marketing",
  "name": "Marketing",
  "description": "Brand, content, and market positioning.",
  "mission": "Build and protect the AVANZIA brand across all channels.",
  "owner": "Chief Marketing Officer",
  "status": "active",
  "tags": ["brand", "content", "positioning", "copywriting"]
}
